{
  "format": 2,
  "name": "wired",
  "description": "Your PC must be wired.",
  "blocks": [
    {
      "type": "heading",
      "text": "__**Your PC must be Wired (one way or another)**__"
    },
    {
      "type": "text",
      "text": "Some ways that you are able to connect your Headset and PC:\n\n* SUPPORTED: If your Headset connects with Wifi, then your PC should connect with Ethernet to the same Gigabit AC/AX/AXE(or better) router that your Headset connects to.\n\n* SUPPORTED: Otherwise, Quest headsets can connect directly to the PC via USB if you install the Virtual Desktop Beta. USB3 connection only works well if you have a high quality USB port and cable. USB2 connection works well with most cables and ports. Visit https://discord.com/channels/564087419918483486/592909523295928340 for more information.\n\n* SUPPORTED: Also, many headsets, (including Quest models, Pico 4 Ultra, PFD and Galaxy XR) are able to use an Ethernet to USB adapter to connect directly to the PC. Due to the inconsistency in the quality of USB ports and cables, this method is found to be better than direct USB. Visit https://discord.com/channels/564087419918483486/1390686127937159209 and/or type `/dongle` here in the channel for more information.\n\n* UNSUPPORTED: Connecting your PC and your headset with Wifi **at the same time** causes too many issues to be supported. Visit https://discord.com/channels/564087419918483486/767976061476405269 for more information.\n\n* UNSUPPORTED: Connecting your Headset to a PC hotspot is possible but the performance is terrible and we do not recommend it."
    }
  ]
}
